<?xml version="1.0" encoding="UTF-8"?>
<!--
    dominique huguenin (dominique.huguenin@rpn.ch)
-->
<?xml-stylesheet type="text/xsl" href= "campanule.xsl" ?>
<commande
    xmlns:xsi="http://www.w3.org/2001/XMLSchema-instance"
    xsi:noNamespaceSchemaLocation="campanule.xsd">
    <identifiant>
        <uuid>DEMO0000-0000-0000-0003-000000000004</uuid>
        <version>0</version>
    </identifiant>
    <mouchard>
        <dateCreation>2017-11-30T08:19:48.743Z</dateCreation>
        <userCreation>testUser</userCreation>
    </mouchard>
    <client>
        <identifiant>
            <uuid>DEMO0000-0000-0000-0002-000000000001</uuid>
            <version>0</version>
        </identifiant>
        <mouchard>
            <dateCreation>2017-11-30T08:19:48.743Z</dateCreation>
            <userCreation>testUser</userCreation>
        </mouchard>
        <nom>DEFRERE</nom>
        <prenom>Marc</prenom>
        <localite>PARIS</localite>
        <codePays>F</codePays>
        <chiffreAffaire>806.00</chiffreAffaire>
        <typeClient>PARTICULIER</typeClient>
    </client>
    <dateCommande>2010-06-10T00:00:00.000Z</dateCommande>
    <lignes>
        <item>
            <article>
                <identifiant>
                    <uuid>DEMO0000-0000-0000-0001-000000000012</uuid>
                    <version>0</version>
                </identifiant>
                <mouchard>
                    <dateCreation>2017-11-30T08:19:48.743Z</dateCreation>
                    <userCreation>testUser</userCreation>
                </mouchard>
                <nom>CRAYON</nom>
                <poids>20.0</poids>
                <couleur>ROUGE</couleur>
                <qteStock>210</qteStock>
                <prixAchat>1.00</prixAchat>
                <prixVente>2.00</prixVente>
            </article>
            <qteCommandee>1</qteCommandee>
            <qteTotaleLivree>0</qteTotaleLivree>
            <prixVenteReel>5.00</prixVenteReel>
            <dateLivraisonPrevue>2010-06-10T00:00:00.000Z</dateLivraisonPrevue>
        </item>
        <item>
            <article>
                <identifiant>
                    <uuid>DEMO0000-0000-0000-0001-000000000005</uuid>
                    <version>0</version>
                </identifiant>
                <mouchard>
                    <dateCreation>2017-11-30T08:19:48.743Z</dateCreation>
                    <userCreation>testUser</userCreation>
                </mouchard>
                <nom>LAMPE</nom>
                <poids>550.0</poids>
                <couleur>BLANC</couleur>
                <qteStock>3</qteStock>
                <prixAchat>100.00</prixAchat>
                <prixVente>149.00</prixVente>
            </article>
            <qteCommandee>1</qteCommandee>
            <qteTotaleLivree>0</qteTotaleLivree>
            <prixVenteReel>149.00</prixVenteReel>
            <dateLivraisonPrevue>2010-06-10T00:00:00.000Z</dateLivraisonPrevue>
        </item>
        <item>
            <article>
                <identifiant>
                    <uuid>DEMO0000-0000-0000-0001-000000000015</uuid>
                    <version>0</version>
                </identifiant>
                <mouchard>
                    <dateCreation>2017-11-30T08:19:48.743Z</dateCreation>
                    <userCreation>testUser</userCreation>
                </mouchard>
                <nom>CRAYON LUXE</nom>
                <poids>20.0</poids>
                <couleur>VERT</couleur>
                <qteStock>90</qteStock>
                <prixAchat>3.00</prixAchat>
                <prixVente>5.00</prixVente>
            </article>
            <qteCommandee>8</qteCommandee>
            <qteTotaleLivree>0</qteTotaleLivree>
            <prixVenteReel>4.00</prixVenteReel>
            <dateLivraisonPrevue>2010-06-10T00:00:00.000Z</dateLivraisonPrevue>
        </item>
        <item>
            <article>
                <identifiant>
                    <uuid>DEMO0000-0000-0000-0001-000000000002</uuid>
                    <version>0</version>
                </identifiant>
                <mouchard>
                    <dateCreation>2017-11-30T08:19:48.743Z</dateCreation>
                    <userCreation>testUser</userCreation>
                </mouchard>
                <nom>CALCULATRICE</nom>
                <poids>150.0</poids>
                <couleur>NOIR</couleur>
                <qteStock>5</qteStock>
                <prixAchat>200.00</prixAchat>
                <prixVente>235.00</prixVente>
            </article>
            <qteCommandee>2</qteCommandee>
            <qteTotaleLivree>0</qteTotaleLivree>
            <prixVenteReel>235.00</prixVenteReel>
            <dateLivraisonPrevue>2010-06-10T00:00:00.000Z</dateLivraisonPrevue>
        </item>
        <item>
            <article>
                <identifiant>
                    <uuid>DEMO0000-0000-0000-0001-000000000013</uuid>
                    <version>0</version>
                </identifiant>
                <mouchard>
                    <dateCreation>2017-11-30T08:19:48.743Z</dateCreation>
                    <userCreation>testUser</userCreation>
                </mouchard>
                <nom>CRAYON</nom>
                <poids>30.0</poids>
                <couleur>BLEU</couleur>
                <qteStock>190</qteStock>
                <prixAchat>1.00</prixAchat>
                <prixVente>2.00</prixVente>
            </article>
            <qteCommandee>10</qteCommandee>
            <qteTotaleLivree>0</qteTotaleLivree>
            <prixVenteReel>4.00</prixVenteReel>
            <dateLivraisonPrevue>2010-06-10T00:00:00.000Z</dateLivraisonPrevue>
        </item>
    </lignes>
</commande>
