<?xml version="1.0" encoding="UTF-8"?>
<!--
    dominique huguenin (dominique.huguenin@rpn.ch)
-->
<?xml-stylesheet type="text/xsl" href= "campanule.xsl" ?>
<clients
    xmlns:xsi="http://www.w3.org/2001/XMLSchema-instance"
    xsi:noNamespaceSchemaLocation="campanule.xsd">
    <client>
        <identifiant>
            <uuid>DEMO0000-0000-0000-0002-000000000001</uuid>
            <version>0</version>
        </identifiant>
        <mouchard>
            <dateCreation>2017-11-30T08:19:48.743Z</dateCreation>
            <userCreation>testUser</userCreation>
        </mouchard>
        <nom>DEFRERE</nom>
        <prenom>Marc</prenom>
        <localite>PARIS</localite>
        <codePays>F</codePays>
        <chiffreAffaire>806.00</chiffreAffaire>
        <typeClient>PARTICULIER</typeClient>
    </client>
    <client>
        <identifiant>
            <uuid>DEMO0000-0000-0000-0002-000000000002</uuid>
            <version>0</version>
        </identifiant>
        <mouchard>
            <dateCreation>2017-11-30T08:19:48.743Z</dateCreation>
            <userCreation>testUser</userCreation>
        </mouchard>
        <nom>DECERF</nom>
        <prenom>Jean</prenom>
        <localite>PARIS</localite>
        <codePays>F</codePays>
        <chiffreAffaire>0.00</chiffreAffaire>
        <typeClient>PARTICULIER</typeClient>
    </client>
    <client>
        <identifiant>
            <uuid>DEMO0000-0000-0000-0002-000000000003</uuid>
            <version>0</version>
        </identifiant>
        <mouchard>
            <dateCreation>2017-11-30T08:19:48.743Z</dateCreation>
            <userCreation>testUser</userCreation>
        </mouchard>
        <nom>DEFAWE</nom>
        <prenom>Leon</prenom>
        <localite>LIEGE</localite>
        <codePays>B</codePays>
        <chiffreAffaire>0.00</chiffreAffaire>
        <typeClient>PARTICULIER</typeClient>
    </client>
    <client>
        <identifiant>
            <uuid>DEMO0000-0000-0000-0002-000000000004</uuid>
            <version>0</version>
        </identifiant>
        <mouchard>
            <dateCreation>2017-11-30T08:19:48.743Z</dateCreation>
            <userCreation>testUser</userCreation>
        </mouchard>
        <nom>NOSSENT</nom>
        <prenom>Serge</prenom>
        <localite>BRUXELLES</localite>
        <codePays>B</codePays>
        <chiffreAffaire>149.00</chiffreAffaire>
        <typeClient>PARTICULIER</typeClient>
    </client>
    <client>
        <identifiant>
            <uuid>DEMO0000-0000-0000-0002-000000000005</uuid>
            <version>0</version>
        </identifiant>
        <mouchard>
            <dateCreation>2017-11-30T08:19:48.743Z</dateCreation>
            <userCreation>testUser</userCreation>
        </mouchard>
        <nom>JACOB</nom>
        <prenom>Marthe</prenom>
        <localite>MARSEILLE</localite>
        <codePays>F</codePays>
        <chiffreAffaire>31.00</chiffreAffaire>
        <typeClient>ADMINISTRATION</typeClient>
    </client>
    <client>
        <identifiant>
            <uuid>DEMO0000-0000-0000-0002-000000000006</uuid>
            <version>0</version>
        </identifiant>
        <mouchard>
            <dateCreation>2017-11-30T08:19:48.743Z</dateCreation>
            <userCreation>testUser</userCreation>
        </mouchard>
        <nom>JAMAR</nom>
        <prenom>Pierre</prenom>
        <localite>LIEGE</localite>
        <codePays>B</codePays>
        <chiffreAffaire>21.00</chiffreAffaire>
        <typeClient>ADMINISTRATION</typeClient>
    </client>
    <client>
        <identifiant>
            <uuid>DEMO0000-0000-0000-0002-000000000007</uuid>
            <version>0</version>
        </identifiant>
        <mouchard>
            <dateCreation>2017-11-30T08:19:48.743Z</dateCreation>
            <userCreation>testUser</userCreation>
        </mouchard>
        <nom>DECKERS</nom>
        <prenom>William</prenom>
        <localite>LYON</localite>
        <codePays>F</codePays>
        <chiffreAffaire>140.00</chiffreAffaire>
        <typeClient>GRAND_COMPTE</typeClient>
    </client>
    <client>
        <identifiant>
            <uuid>DEMO0000-0000-0000-0002-000000000008</uuid>
            <version>0</version>
        </identifiant>
        <mouchard>
            <dateCreation>2017-11-30T08:19:48.743Z</dateCreation>
            <userCreation>testUser</userCreation>
        </mouchard>
        <nom>DECLERCQ</nom>
        <prenom>Lucien</prenom>
        <localite>BRUXELLES</localite>
        <codePays>B</codePays>
        <chiffreAffaire>349.00</chiffreAffaire>
        <typeClient>GRAND_COMPTE</typeClient>
    </client>
    <client>
        <identifiant>
            <uuid>DEMO0000-0000-0000-0002-000000000009</uuid>
            <version>0</version>
        </identifiant>
        <mouchard>
            <dateCreation>2017-11-30T08:19:48.743Z</dateCreation>
            <userCreation>testUser</userCreation>
        </mouchard>
        <nom>DEFYZ</nom>
        <prenom>Maurice</prenom>
        <localite>BORDEAUX</localite>
        <codePays>F</codePays>
        <chiffreAffaire>0.00</chiffreAffaire>
        <typeClient>PARTICULIER</typeClient>
    </client>
    <client>
        <identifiant>
            <uuid>DEMO0000-0000-0000-0002-000000000010</uuid>
            <version>0</version>
        </identifiant>
        <mouchard>
            <dateCreation>2017-11-30T08:19:48.743Z</dateCreation>
            <userCreation>testUser</userCreation>
        </mouchard>
        <nom>DEFOOZ</nom>
        <prenom>Francis</prenom>
        <localite>LILLE</localite>
        <codePays>F</codePays>
        <chiffreAffaire>60.00</chiffreAffaire>
        <typeClient>PARTICULIER</typeClient>
    </client>
    <client>
        <identifiant>
            <uuid>DEMO0000-0000-0000-0002-000000000011</uuid>
            <version>0</version>
        </identifiant>
        <mouchard>
            <dateCreation>2017-11-30T08:19:48.743Z</dateCreation>
            <userCreation>testUser</userCreation>
        </mouchard>
        <nom>RAMJOIE</nom>
        <prenom>Victor</prenom>
        <localite>NANTES</localite>
        <codePays>F</codePays>
        <chiffreAffaire>0.00</chiffreAffaire>
        <typeClient>PARTICULIER</typeClient>
    </client>
    <client>
        <identifiant>
            <uuid>DEMO0000-0000-0000-0002-000000000012</uuid>
            <version>0</version>
        </identifiant>
        <mouchard>
            <dateCreation>2017-11-30T08:19:48.743Z</dateCreation>
            <userCreation>testUser</userCreation>
        </mouchard>
        <nom>RENARDY</nom>
        <prenom>Jean</prenom>
        <localite>MARSEILLE</localite>
        <codePays>F</codePays>
        <chiffreAffaire>275.00</chiffreAffaire>
        <typeClient>GRAND_COMPTE</typeClient>
    </client>
    <client>
        <identifiant>
            <uuid>DEMO0000-0000-0000-0002-000000000013</uuid>
            <version>0</version>
        </identifiant>
        <mouchard>
            <dateCreation>2017-11-30T08:19:48.743Z</dateCreation>
            <userCreation>testUser</userCreation>
        </mouchard>
        <nom>MANTEAU</nom>
        <prenom>Yvan</prenom>
        <localite>PARIS</localite>
        <codePays>F</codePays>
        <chiffreAffaire>320.00</chiffreAffaire>
        <typeClient>GRAND_COMPTE</typeClient>
    </client>
    <client>
        <identifiant>
            <uuid>DEMO0000-0000-0000-0002-000000000014</uuid>
            <version>0</version>
        </identifiant>
        <mouchard>
            <dateCreation>2017-11-30T08:19:48.743Z</dateCreation>
            <userCreation>testUser</userCreation>
        </mouchard>
        <nom>JONAS</nom>
        <prenom>Henri</prenom>
        <localite>PARIS</localite>
        <codePays>F</codePays>
        <chiffreAffaire>0.00</chiffreAffaire>
        <typeClient>PME</typeClient>
    </client>
    <client>
        <identifiant>
            <uuid>DEMO0000-0000-0000-0002-000000000015</uuid>
            <version>0</version>
        </identifiant>
        <mouchard>
            <dateCreation>2017-11-30T08:19:48.743Z</dateCreation>
            <userCreation>testUser</userCreation>
        </mouchard>
        <nom>DELVENNE</nom>
        <prenom>Christian</prenom>
        <localite>LYON</localite>
        <codePays>F</codePays>
        <chiffreAffaire>0.00</chiffreAffaire>
        <typeClient>GRAND_COMPTE</typeClient>
    </client>
    <client>
        <identifiant>
            <uuid>DEMO0000-0000-0000-0002-000000000016</uuid>
            <version>0</version>
        </identifiant>
        <mouchard>
            <dateCreation>2017-11-30T08:19:48.743Z</dateCreation>
            <userCreation>testUser</userCreation>
        </mouchard>
        <nom>DEFEEZ</nom>
        <prenom>Andre</prenom>
        <localite>LYON</localite>
        <codePays>F</codePays>
        <chiffreAffaire>0.00</chiffreAffaire>
        <typeClient>PARTICULIER</typeClient>
    </client>
</clients>
